{
  "session_id": "full-flow-board-log-rework-closure",
  "producer_agent": "workflow-orchestrator",
  "close_allowed": true,
  "review_status": "approved",
  "evidence_status": "sufficient",
  "repo_state": "reviewed",
  "board_state": "passed",
  "knowledge_state": "context_ready",
  "required_artifacts": ["evidence_manifest", "review_decision", "board_validation_result", "route_history"],
  "blockers": []
}
