{
  "session_id": "knowledge-writeback-closure",
  "producer_agent": "workflow-orchestrator",
  "close_allowed": false,
  "review_status": "approved",
  "evidence_status": "sufficient",
  "repo_state": "reviewed",
  "board_state": "passed",
  "knowledge_state": "context_ready",
  "required_artifacts": ["evidence_manifest", "review_decision"],
  "blockers": ["closure_not_approved"]
}
